pcm_review	sentiment
I fit tell you with confidence say Luna taking a shift dey very interesting pass chief daddy 2	negative
I no realise how many plane crashes dey Nigeria, and dis film come out five days 	negative
Dis movie suppose better if to say dem used plenti money to produce am,	negative
Wth no modulating direction and no softness, dis one na long, hard persistent work wey go dey best appreciated by friends and family of those wey dey cast and crew.	negative
E no worth your time	negative
Talk rubbish. . E dey very rare say I dey give up on film, I no fit finish am, I give up after 30mins. No waste your time.	negative
Utimately dampening di film overall for what wey go don dey stronger, e dey honest and sad roller coaster.	negative
Unfortunately lack of attention to details no dey stop with di aforementioned examples.	negative
Di wait  dey full of stars, but e no dey shine  right. E be like say you dey taste a glass of wine wey never develop well, perhaps, dem make am with unripe grapes.	negative
Di movie dey very cheap.	negative
Dis film too dry and e dey terrible  	negative
Hallmarked by nonesense, 'The Culprit' don complete and talk rubbish!	negative
I just watch am for academic purposes.	negative
E too slow. Whick kain waste of time.	negative
E too boring.	negative
Dat movie too bad for Nollywood	negative
I catch di Nollywood bug as I dey watch Rattlesnake.	negative
With all hin funny exaggeration and acting performance wey dey flunctuate between over-acting and acting wey bad.	negative
Di production dey everywhere, and most character no dey fully developed.	negative
Na waste of time and resources	negative
You go hate am.	negative
di storyline dey beautiful BUT na hin waste my precious 2hrs	negative
Dem  fit try as hard as dem may; 'Your Excellency' proved extensively impotent, hin dey fail to deliver on its campaign promises	negative
Na total nonsense. . E no even worth being filmed. Actors dey weak, scripts was written by 12 year old. E get poor sound quality.	negative
Taking a beautiful, soap-opera route through di Nigerian civil war of di 1960s wey turn out to be a navigational error from which dis lavishly appointed production fit never recover fully.	negative
Dis wan fail to give us anytin e just dey boring. E no get any step by step flow	negative
Di acting no gud atall,but di film still sweet.	negative
Dis wan na No, No! di performance bad from di di main di main actor.	negative
E dey sweet, even though say na mess up	negative
Dis film  be like collection of ideas wey neva too develop wit some kain romance wey Dem put.	negative
Di film script no fit pass for high school amateur production.	negative
I no like dis film atall	negative
Di acting too bad and di wey dem write am even worst.	negative
Di acting just dull, dI dialogue inside just dey anyhow, as if dem dey remind di actor dem wetin Dem suppos yarn.	negative
Everytin about dis film  na low budget	negative
Dem plan am just to waste ur time!	negative
Na big mess	negative
Na only for broad Nollywood comedy mode shey e really feel convinces.	negative
charmed' no be charming...how ahbeg!	negative
Horrible...di show just dey go notin make sense inside at time.	negative
Di Fact say na musical make am very TERRIBLE.	negative
Complete fiction..Di acting worst and di tori no dey believable.	negative
LMAO	negative
Big disappointment, 'Levi' na drama wey no get purpose.	negative
"Di film dey remarkable as e no feel sori for im sef atall, but e make ""farming"" lack mercy for audience Dem face too."	negative
I dey convince e for beta as 10 to 30 minute short film  to test di wata.	negative
Drama wey no get porpose.	negative
Di intention gud but na novince attempt dem use  move di people wey dey watch	negative
Just imagine say u wan try run indomie without di spice .. . Dis film too bad so tey 5 minutes to di finishing u go still dey wonda say wetin dey hapin.	negative
U no fit believe di screenplay	negative
Dem just gum diffrend jokes togeda, memes and videos wey dem dey call comedy wey don cast  for Naija social media, call am dem own film and carry am go cinema. If you dey big ontop social media, u go don see many of dem, many time before... And you no go wan find dem to be funny here as di people wey produce am fail to win for copy copy, comeleave 'Social media  101' wahala for di bottom of di barrel acting, di dialogue dey very boring and di main di main na di horrible scene lighting. Dis one na one big bad thing!	negative
"Dis film  ugly. ""Ugly"" na di main word ."	negative
Anoda Naija film wey Dem use hype kill but e too empty. I no fit recomend am for anybodi.	negative
No be say dis wan too bad, but di script and how dem direct am na ein suffer am. 	negative
Di opening of di fim clash. Dem no create backtori for Laila appearance	negative
Di Tori telling too poor ....and Dem too rewrite history bikos of di film  plot.	negative
Delay. Unnecessary And no make sense.	negative
No b beta film  	negative
Dis film  no make for eye atall.	negative
Na pieces tori, pesin fit swear say na one primary sku pikin  just rush write am, wen Dem wan do last year presentation drama.	negative
 If sa you value your time, make you work hard make you dodge dis for di premium.	negative
Film fit bad, but make im important?	negative
If I be film Prof I kon dia try to  torture my student, I no fit think for better required screening.	negative
E too  long acting wey bad, wetin no get meanin too much.	negative
By force tori wit bad actin wey dey embarrassin wit di hallmark of dis shabby pretender.	negative
How film with dis subject matter wind up fit slow like dis and boring	negative
Dis one na tori wey get potential to critical acclaim, but as dem take do am poor and e make am easy to forget	negative
Dis film get small charisma pass 'Third Eye' series from nineties with Pa Olu Jacob. No put mouth for dis one	negative
Nollywood just dey disgrace us	negative
Survival of Jelili na pageantry rubbish wey dey vex person.	negative
For di conclusion for original chief Daddy film, de introduction for one new character for de last scene hinted for  sequel, but chief Daddy self take sophomore curse for one new level of low.	negative
E no suppose to end there...screenwriter wey no sabi work 	negative
Di plot no dey realistic atall and e dia for everiwhere 	negative
Na big waste for time and money	negative
Dis film dey lame, even children no go like ahm.	negative
