review,sentiment
"We call it a kidnap- Held hostage for fifty odd minutes, we were forced on an excursion of the resort grounds, Not recommended.",negative
This lion didn't have much of a roar. Did someone send their failed Netflix pilot script to Nigeria like it was the losing Super Bowl team's t-shirt?,negative
Forceful story-telling and embarrassingly bad acting are the hallmarks of this shabby pretender - Might sound weird but; this flick is like a counterfeit of 'Isoken'.,negative
Dumb movie. . This movie is a joke.,negative
Diabolically bad!. . This is realistically the worst movie I've ever seen in my life!,negative
"Action sequences weren't bad and its heart was in the right place, but quite painful to watch in places.",negative
"Though the cinematography looks professional, don't let this film fool you. It's a disaster.",negative
"No head, no tail, bad script, absolute waste of time and expensive rubbish. Movie was such a pain to watch. I highly do not recommend.",negative
their star quality is lacking in this movie,negative
lolz,negative
Verdict: Not recommended. 'Charmed' is not charming.,negative
"So disapppointed.. . Some acting moments from main actors (king and Amina), but the supporting actor (Maladi), hard to tell if he is comic relief because his role should be serious.",negative
Rubbish! Not recommended for anybody. Not even children. Very irritating movie.,negative
Hands down one of the worst movies I’ve ever seen,negative
Worst remake. . There was poor directing at the beginning during Ahannas flashbacks when he witnessed a man being set ablaze.,negative
Rubbish. . . . One more piece of garbage from NETFLIX. Period !!,negative
Extremely flawed,negative
I skimmed this. no way i’m watching the whole thing,negative
you will regret wasting your time watching this movie,negative
Poor,negative
Excessively basic.,negative
The Millions' is essentially a shameless wholesale theft of 'Ocean's film series' scripts; we were not impressed.,negative
"Gbarada' is a typical Idumota ""Yoruba film"" with all the craziness that come with that sub-section of Nollywood.",negative
Holy one of Israel!. . What did Genevieve think she just did? A movie? This is corruption in the highest. The writers are quack.,negative
the worst movie production ever,negative
Just Crap,negative
Special Jollof' is yet another cold turkey from Nollywood in Diaspora. And as usual; it is highlighted by a yéyé story and a plethora of half hearted acting performances. There's nothing to see here. It's a total waste of money and time.,negative
I can confidently say that Luna taking a shit is a way more engaging story than chief daddy 2.,negative
"i did not realise how many plane crashes there were in nigeria, and this film came out five days",negative
"This Movie Would Have Done Better If Funded More ,",negative
"With no modulating direction and no subtlety, this is a long, hard slog that will best be appreciated by friends and family of those in the cast and crew",negative
Not worth your time,negative
"Utter rubbish. . It's very rare that I give up on a film, I couldn't finish this, gave up after 30mins. Don't waste your time.",negative
"ultimately dampening the film overall for what could have been an even stronger, hard-hitting and poignant emotional roller coaster.",negative
Unfortunately lack of attention to detail didn't stop with the aforementioned examples.,negative
"The Wait is full of stars, but it does not shine bright. It is like tasting a glass of wine that has not fully developed, perhaps, made with unripe grapes.",negative
This movie is so cheesy.,negative
this is an extremely boring and terrible film,negative
"Hallmarked by nonsense, 'The Culprit' is complete and utter rubbish!",negative
Had to watch it for academic purposes.,negative
Way too slow. What a waste of time.,negative
Booorrring.,negative
That movie is such a bad egg to Nollywood.,negative
I caught the Nollywood bug while watching Rattlesnake.,negative
With all its ridiculous comical exaggerations and acting performances that fluctuate between over-acting and bad-acting.,negative
"The production is all over the place, and most characters are not fully developed.",negative
waste of time and resources,negative
You will hate it,negative
Beautiful storyline BUT It was a waste of precious 2hrs,negative
"Try as hard as they may; 'Your Excellency' proved extensively impotent, failing to deliver on its campaign promises.",negative
"Absolute Garbage. . Not even worth being filmed. Actors are weak, script was written by a 12 year old. Poor sound quality.",negative
"Taking a scenic, soap-opera route through the Nigerian civil war of the 1960s turns out to be a navigational error from which this lavishly appointed production can never fully recover.",negative
"However, this failed to be anything other than boring. It had no logical flow",negative
"Very bad acting, but the movie is still entertaining.",negative
"This was a No, No! Really bad performances from the main cast.",negative
Entertaining despite being flawed,negative
This movie feels like a mish mash of under-developed ideas with a half hearted romance thrown in.,negative
The movie script cannot pass for a high school amateur production.,negative
I dislike this movie so much,negative
The acting was SO bad and the  writing was even worse.,negative
"The acting is at best wooden, the dialogue almost staccato, as if the actors are constantly being prompted with their lines.",negative
Everything about this movie speaks low budget,negative
Dig to stole your time!,negative
What a Mess,negative
Only in broad Nollywood comedy mode does it feel truly convincing.,negative
Charmed' is not charming. No how!,negative
Horrible. . The show lingers on and on seeming to go no where at times.,negative
The fact that it's a musical makes it absolutely TERRIBLE.,negative
Utter fiction. The acting is awful and the story unbelievable.,negative
LMAO,negative
"A sore disappointment, 'Levi' is drama without purpose.",negative
"The film is remarkable for its lack of self-pity, but it makes the experience of ""Farming"" a merciless one for the audience too.",negative
I am convinced it would have fared better as a 10 to 30 minute short movie to test the waters.,negative
drama without purpose.,negative
Well intentioned but amateurish attempt to move the viewer.,negative
Imagine trying to make indomie without spice. . This movie is soo bad that 5 minutes to the end you're still wondering what's going o.,negative
The screenplay is ridiculous,negative
"They just sewed together different jokes, memes and videos of little known comics that have gone viral on Nigerian social media, called it their own movie and brought it to cinema. If you are Big on social media, you will have seen many of them, many times before. And you are not likely to find them to be very funny here as the producers even fail to excel at plagiarism, leaving 'Social Media 101' plagued by bottom of the barrel acting, very boring dialogue and particularly horrible scene lighting. This is all round ridiculous!",negative
"This movie is ugly. ""Ugly"" must be the word.",negative
Another Nigerian Movie With Lot of Hype but Very Empty.. . I won't recommend this to anyone.,negative
It's not really that bad - but the script and directing suffers overall.,negative
The movie’s opening is jarring. There is no backstory for Laila’s appearance,negative
Very poor story telling... and a massive rewrite of history for the sake of the movies plot.,negative
Retarded. Gratuitous. And senseless.,negative
Not a great movie,negative
This movie was an eyesore,negative
it tells a piecemeal story one could swear was hurriedly written by a primary school pupil for last year's Cultural Day drama presentation,negative
"If you value your time, work hard to dodge this at a premium.",negative
"Can a movie be bad, but important?",negative
"If I were a film prof trying to get away with torturing my students, I truly cannot think of a better fit for a required screening.",negative
"Too long, bad acting, too much irrelevance",negative
. Forceful story-telling and embarrassingly bad acting are the hallmarks of this shabby pretender.,negative
How does a movie with this subject matter wind up being this slow and boring?,negative
"this is a story that has the potential for critical acclaim, but the execution is poor and makes it easily forgettable.",negative
This movie has less charisma than the 'Third Eye' series from the nineties with Pa Olu Jacobs. Stay away from this.,negative
nollywood keeps disgracing us,negative
Survival of Jelili' is a pageantry of the absurd and a flagrant eyesore.,negative
"At the conclusion of the original Chief Daddy movie, the introduction of a new character in the last scene hinted at a sequel, but Chief Daddy 2 takes the sophomore curse to a new level of low.",negative
Wasn't supposed to end there.. unprofessional screenwriter,negative
The plot was totally unrealistic and it was all over the place.,negative
A colossal waste of time and money,negative
"this movie is so lame, even children will not like it.",negative
